generators/autotest/test_generators_inverter_volt_var_converted.json

{
  "__preamble": {
    "comments": [
      "// Test the volt var mode for four quadrant inverter."
    ]
  },
  "classes": {
    "player": [
      {
        "type": "complex",
        "name": "value"
      }
    ]
  },
  "clock": {
    "timezone": "PST+8PDT",
    "starttime": "'2015-01-01 00:00:00'",
    "stoptime": "'2015-01-01 00:25:00'"
  },
  "modules": {
    "generators": {},
    "powerflow": {
      "solver_method": "NR"
    },
    "tape": {},
    "assert": {}
  },
  "objects": {
    "player": {
      "instances": [
        {
          "name": "player_1",
          "parent": "swingbus",
          "property": "voltage_A",
          "file": "../test_generators_inverter_volt_var_voltageA.player",
          "loop": 0
        },
        {
          "name": "player_2",
          "parent": "swingbus",
          "property": "voltage_B",
          "file": "../test_generators_inverter_volt_var_voltageB.player",
          "loop": 0
        },
        {
          "name": "player_3",
          "parent": "swingbus",
          "property": "voltage_C",
          "file": "../test_generators_inverter_volt_var_voltageC.player",
          "loop": 0
        },
        {
          "name": "player_12",
          "parent": "complex_assert_11",
          "property": "value",
          "file": "../test_generators_inverter_vv_output_A.player",
          "loop": 0
        },
        {
          "name": "player_14",
          "parent": "complex_assert_13",
          "property": "value",
          "file": "../test_generators_inverter_vv_output_B.player",
          "loop": 0
        },
        {
          "name": "player_16",
          "parent": "complex_assert_15",
          "property": "value",
          "file": "../test_generators_inverter_vv_output_C.player",
          "loop": 0
        }
      ]
    },
    "overhead_line_conductor": {
      "instances": [
        {
          "name": "olc6010",
          "geometric_mean_radius": 0.0313,
          "diameter": "0.927 in",
          "resistance": 0.1859,
          "outside_comments": [
            "// Phase Conductor for 601: 556,500 26/7 ACSR"
          ]
        },
        {
          "name": "olc6020",
          "geometric_mean_radius": 0.00814,
          "diameter": "0.56 in",
          "resistance": 0.592,
          "outside_comments": [
            "// Phase Conductor for 602: 4/0 6/1 ACSR"
          ]
        },
        {
          "name": "olc6030",
          "geometric_mean_radius": 0.00446,
          "diameter": "0.4 in",
          "resistance": 1.12,
          "outside_comments": [
            "// Phase Conductor for 603, 604, 605: 1/0 ACSR"
          ]
        }
      ]
    },
    "underground_line_conductor": {
      "instances": [
        {
          "name": "ulc6060",
          "outer_diameter": 1.29,
          "conductor_gmr": 0.0171,
          "conductor_diameter": 0.567,
          "conductor_resistance": 0.41,
          "neutral_gmr": 0.00208,
          "neutral_resistance": 14.872,
          "neutral_diameter": 0.0640837,
          "neutral_strands": 13.0,
          "insulation_relative_permitivitty": 2.3,
          "shield_gmr": 0.0,
          "shield_resistance": 0.0,
          "outside_comments": [
            "// Phase Conductor for 606: 250,000 AA,CN"
          ]
        },
        {
          "name": "ulc6070",
          "outer_diameter": 1.06,
          "conductor_gmr": 0.0111,
          "conductor_diameter": 0.368,
          "conductor_resistance": 0.97,
          "neutral_gmr": 0.0111,
          "neutral_resistance": 0.97,
          "neutral_diameter": 0.0640837,
          "neutral_strands": 6.0,
          "insulation_relative_permitivitty": 2.3,
          "shield_gmr": 0.0,
          "shield_resistance": 0.0,
          "outside_comments": [
            "// Phase Conductor for 607: 1/0 AA,TS N: 1/0 Cu"
          ],
          "inline_comments": {
            "neutral_resistance": "// Unsure whether this is correct"
          }
        }
      ]
    },
    "meter": {
      "instances": [
        {
          "name": "swingbus",
          "phases": "ABCN",
          "bustype": "SWING",
          "nominal_voltage": 7200
        },
        {
          "name": "inv_meter",
          "phases": "ABC",
          "parent": "swingbus",
          "nominal_voltage": 7200
        }
      ]
    },
    "complex_assert": {
      "instances": [
        {
          "name": "complex_assert_11",
          "parent": "inv_meter",
          "target": "measured_power_A",
          "within": 0.1
        },
        {
          "name": "complex_assert_13",
          "parent": "inv_meter",
          "target": "measured_power_B",
          "within": 0.1
        },
        {
          "name": "complex_assert_15",
          "parent": "inv_meter",
          "target": "measured_power_C",
          "within": 0.1
        }
      ]
    },
    "inverter": {
      "instances": [
        {
          "name": "volt_var_inv",
          "parent": "inv_meter",
          "inverter_type": "FOUR_QUADRANT",
          "four_quadrant_control_mode": "VOLT_VAR",
          "generator_status": "ONLINE",
          "generator_mode": "SUPPLY_DRIVEN",
          "phases": "ABC",
          "rated_power": "70 kVA",
          "inverter_efficiency": 0.87,
          "V_base": 7200,
          "V1": 0.9,
          "Q1": 0.7,
          "V2": 0.95,
          "Q2": 0.0,
          "V3": 1.05,
          "Q3": 0.0,
          "V4": 1.1,
          "Q4": -0.8,
          "V_In": 200.0,
          "I_In": 200.0,
          "inside_comments": [
            "//Volt Var parameters;"
          ],
          "inline_comments": {
            "rated_power": "// per phase;"
          }
        }
      ]
    },
    "load": {
      "instances": [
        {
          "name": "load",
          "phases": "ABCN",
          "parent": "swingbus",
          "constant_power_A": "12000+5600j",
          "constant_power_B": "46000-2300j",
          "constant_power_C": "68000+9000j",
          "nominal_voltage": 7200
        }
      ]
    }
  }
}

docs/docs/7.0 References/Unimplemented/Neutral Earth Voltage/Spec_NEVLink.md

### Class: overhead_line_conductor

object overhead_line_conductor {
             name ohc1;
             diameter 1.2;
             geometric_mean_radius 0.01710;
             conductor_diameter 0.00446;
             resistance 1.12;
        }

### Class: underground_line_conductor

object underground_line_conductor {
             name ulc1;
             type CONCENTRIC_NEUTRAL;
             outer_diameter 1.29;
             conductor_gmr 0.01710;
             conductor_diameter 0.567;
             conductor_resistance 0.41;
             neutral_gmr 0.00208;
             neutral_diameter 0.0640837;
             neutral_resistance 14.872;
             neutral_strands 13;
        }

object underground_line_conductor {
             name ulc3;
             type INSULATED;
             outer_diameter 1.29;
             conductor_gmr 0.01710;
             conductor_diameter 0.567;
             conductor_resistance 0.41;
        }