tape/autotest/test_metrics_collector_converted.json

{
  "__preamble": {
    "comments": [
      "//#set minimum_timestep=60;"
    ]
  },
  "_directives": {
    "#include": [
      "../water_and_setpoint_schedule_v3.json"
    ],
    "#set": {
      "double_format": "%+.12lg",
      "randomseed": "10;",
      "relax_naming_rules": "1;"
    }
  },
  "clock": {
    "timezone": "EST+5EDT",
    "timestamp": "'2010-08-15 00:00:00'",
    "stoptime": "'2010-08-16 00:12:00'"
  },
  "modules": {
    "powerflow": {
      "solver_method": "FBS",
      "NR_iteration_limit": 100
    },
    "residential": {
      "implicit_enduses": "NONE"
    },
    "tape": {}
  },
  "objects": {
    "metrics_collector_writer": {
      "instances": [
        {
          "interval": 300,
          "interim": 3600,
          "filename": "sub_",
          "alternate": "yes",
          "extension": "json"
        }
      ]
    },
    "transformer_configuration": {
      "instances": [
        {
          "name": "substation_config",
          "connect_type": "WYE_WYE",
          "install_type": "PADMOUNT",
          "primary_voltage": "7200 V",
          "secondary_voltage": "7200 V",
          "power_rating": 75,
          "powerA_rating": 25,
          "powerB_rating": 25,
          "powerC_rating": 25,
          "impedance": "0.0015+0.00675j"
        },
        {
          "name": "default_transformer_A",
          "connect_type": "SINGLE_PHASE_CENTER_TAPPED",
          "install_type": "PADMOUNT",
          "primary_voltage": "7200 V",
          "secondary_voltage": "124 V",
          "power_rating": 25,
          "powerA_rating": 25,
          "impedance": "0.015+0.0675j"
        },
        {
          "name": "default_transformer_B",
          "connect_type": "SINGLE_PHASE_CENTER_TAPPED",
          "install_type": "PADMOUNT",
          "primary_voltage": "7200 V",
          "secondary_voltage": "124 V",
          "power_rating": 25,
          "powerB_rating": 25,
          "impedance": "0.015+0.0675j"
        },
        {
          "name": "default_transformer_C",
          "connect_type": "SINGLE_PHASE_CENTER_TAPPED",
          "install_type": "PADMOUNT",
          "primary_voltage": "7200 V",
          "secondary_voltage": "124 V",
          "power_rating": 25,
          "powerC_rating": 25,
          "impedance": "0.015+0.0675j"
        }
      ]
    },
    "triplex_line_conductor": {
      "instances": [
        {
          "name": "Name_1_0_AA_triplex",
          "resistance": 0.57,
          "geometric_mean_radius": 0.0111
        }
      ]
    },
    "triplex_line_configuration": {
      "instances": [
        {
          "name": "TLCFG",
          "conductor_1": "Name_1_0_AA_triplex",
          "conductor_2": "Name_1_0_AA_triplex",
          "conductor_N": "Name_1_0_AA_triplex",
          "insulation_thickness": 0.08,
          "diameter": 0.368
        }
      ]
    },
    "meter": {
      "instances": [
        {
          "name": "ROOT",
          "bustype": "SWING",
          "phases": "ABCN",
          "nominal_voltage": 7200
        },
        {
          "name": "_transformer_meter",
          "phases": "ABCN",
          "nominal_voltage": 7200
        }
      ]
    },
    "recorder": {
      "instances": [
        {
          "parent": "_Transformer1",
          "property": "power_out_real",
          "limit": 100000000,
          "interval": 60,
          "file": "totalload_5_houses_Aug.csv"
        }
      ]
    },
    "transformer": {
      "instances": [
        {
          "name": "_Transformer1",
          "phases": "ABCN",
          "groupid": "_Network_Trans",
          "from": "ROOT",
          "to": "_transformer_meter",
          "configuration": "substation_config"
        },
        {
          "name": "_center_tap_transformer_A",
          "phases": "AS",
          "from": "_transformer_meter",
          "to": "_triplex_node_A",
          "configuration": "default_transformer_A"
        },
        {
          "name": "_center_tap_transformer_B",
          "phases": "BS",
          "from": "_transformer_meter",
          "to": "_triplex_node_B",
          "configuration": "default_transformer_B"
        },
        {
          "name": "_center_tap_transformer_C",
          "phases": "CS",
          "from": "_transformer_meter",
          "to": "_triplex_node_C",
          "configuration": "default_transformer_C"
        }
      ]
    },
    "triplex_meter": {
      "instances": [
        {
          "name": "_triplex_node_A",
          "phases": "AS",
          "nominal_voltage": 124.0
        },
        {
          "name": "_triplex_node_B",
          "phases": "BS",
          "nominal_voltage": 124.0
        },
        {
          "name": "_triplex_node_C",
          "phases": "CS",
          "nominal_voltage": 124.0
        },
        {
          "name": "_tpm_flatrate_A1",
          "nominal_voltage": 124,
          "phases": "AS",
          "groupid": "_flatrate_meter"
        },
        {
          "name": "_tpm_rt_A1",
          "nominal_voltage": 124,
          "phases": "AS",
          "groupid": "_rt_meter",
          "parent": "_tpm_flatrate_A1"
        },
        {
          "name": "_tpm_flatrate_B2",
          "nominal_voltage": 124,
          "phases": "BS",
          "groupid": "_flatrate_meter"
        },
        {
          "name": "_tpm_rt_B2",
          "nominal_voltage": 124,
          "phases": "BS",
          "groupid": "_rt_meter",
          "parent": "_tpm_flatrate_B2"
        },
        {
          "name": "_tpm_flatrate_B3",
          "nominal_voltage": 124,
          "phases": "BS",
          "groupid": "_flatrate_meter"
        },
        {
          "name": "_tpm_rt_B3",
          "nominal_voltage": 124,
          "phases": "BS",
          "groupid": "_rt_meter",
          "parent": "_tpm_flatrate_B3"
        },
        {
          "name": "_tpm_flatrate_C4",
          "nominal_voltage": 124,
          "phases": "CS",
          "groupid": "_flatrate_meter"
        },
        {
          "name": "_tpm_rt_C4",
          "nominal_voltage": 124,
          "phases": "CS",
          "groupid": "_rt_meter",
          "parent": "_tpm_flatrate_C4"
        },
        {
          "name": "_tpm_flatrate_C5",
          "nominal_voltage": 124,
          "phases": "CS",
          "groupid": "_flatrate_meter"
        },
        {
          "name": "_tpm_rt_C5",
          "nominal_voltage": 124,
          "phases": "CS",
          "groupid": "_rt_meter",
          "parent": "_tpm_flatrate_C5"
        }
      ]
    },
    "triplex_line": {
      "instances": [
        {
          "from": "_triplex_node_A",
          "to": "_tpm_flatrate_A1",
          "groupid": "_Triplex_Line",
          "phases": "AS",
          "length": 10,
          "configuration": "TLCFG"
        },
        {
          "from": "_triplex_node_B",
          "to": "_tpm_flatrate_B2",
          "groupid": "_Triplex_Line",
          "phases": "BS",
          "length": 10,
          "configuration": "TLCFG"
        },
        {
          "from": "_triplex_node_B",
          "to": "_tpm_flatrate_B3",
          "groupid": "_Triplex_Line",
          "phases": "BS",
          "length": 10,
          "configuration": "TLCFG"
        },
        {
          "from": "_triplex_node_C",
          "to": "_tpm_flatrate_C4",
          "groupid": "_Triplex_Line",
          "phases": "CS",
          "length": 10,
          "configuration": "TLCFG"
        },
        {
          "from": "_triplex_node_C",
          "to": "_tpm_flatrate_C5",
          "groupid": "_Triplex_Line",
          "phases": "CS",
          "length": 10,
          "configuration": "TLCFG"
        }
      ]
    },
    "metrics_collector": {
      "instances": [
        {
          "parent": "H_1wh_1",
          "interval": 300
        },
        {
          "parent": "H_1",
          "interval": 300
        },
        {
          "parent": "H_2wh_2",
          "interval": 300
        },
        {
          "parent": "H_2",
          "interval": 300
        },
        {
          "parent": "H_3wh_3",
          "interval": 300
        },
        {
          "parent": "H_3",
          "interval": 300
        },
        {
          "parent": "H_4wh_4",
          "interval": 300
        },
        {
          "parent": "H_4",
          "interval": 300
        },
        {
          "parent": "H_5wh_5",
          "interval": 300
        },
        {
          "parent": "H_5",
          "interval": 300
        }
      ]
    },
    "waterheater": {
      "instances": [
        {
          "name": "H_1wh_1",
          "parent": "H_1",
          "schedule_skew": -5660,
          "heating_element_capacity": "4.0 kW",
          "thermostat_deadband": 1.0,
          "location": "INSIDE",
          "tank_diameter": 1.5,
          "tank_UA": 3.6,
          "water_demand": 4.02,
          "tank_volume": 50,
          "waterheater_model": "MULTILAYER",
          "discrete_step_size": 60.0,
          "lower_tank_setpoint": 117.3,
          "upper_tank_setpoint": 127.3,
          "T_mixing_valve": 122.3
        },
        {
          "name": "H_2wh_2",
          "parent": "H_2"
        },
        {
          "name": "H_3wh_3",
          "parent": "H_3",
          "schedule_skew": -2094,
          "heating_element_capacity": "5.0 kW",
          "thermostat_deadband": 1.0,
          "location": "INSIDE",
          "tank_diameter": 1.5,
          "tank_UA": 3.5,
          "water_demand": 10.03,
          "tank_volume": 70,
          "waterheater_model": "MULTILAYER",
          "discrete_step_size": 60.0,
          "lower_tank_setpoint": 119.2,
          "upper_tank_setpoint": 129.2,
          "T_mixing_valve": 124.2
        },
        {
          "name": "H_4wh_4",
          "parent": "H_4",
          "schedule_skew": -13972,
          "heating_element_capacity": "5.5 kW",
          "thermostat_deadband": 1.0,
          "location": "INSIDE",
          "tank_diameter": 1.5,
          "tank_UA": 3.9,
          "water_demand": 8.01,
          "tank_volume": 60,
          "waterheater_model": "MULTILAYER",
          "discrete_step_size": 60.0,
          "lower_tank_setpoint": 113.2,
          "upper_tank_setpoint": 123.2,
          "T_mixing_valve": 118.2
        },
        {
          "name": "H_5wh_5",
          "parent": "H_5"
        }
      ]
    },
    "house": {
      "instances": [
        {
          "name": "H_1",
          "parent": "_tpm_rt_A1",
          "schedule_skew": -685,
          "Rroof": 33.69,
          "Rwall": 17.71,
          "Rfloor": 17.02,
          "Rdoors": 5,
          "Rwindows": 1.81,
          "airchange_per_hour": 0.8,
          "hvac_power_factor": 0.97,
          "cooling_system_type": "ELECTRIC",
          "heating_system_type": "RESISTANCE",
          "fan_type": "ONE_SPEED",
          "hvac_breaker_rating": 200,
          "total_thermal_mass_per_floor_area": 3.01,
          "motor_efficiency": "AVERAGE",
          "motor_model": "BASIC",
          "cooling_COP": 3.9,
          "floor_area": 1040,
          "number_of_doors": 2,
          "air_temperature": 71.9,
          "mass_temperature": 71.9,
          "inside_comments": [
            "//Residential_2"
          ]
        },
        {
          "name": "H_2",
          "parent": "_tpm_rt_B2",
          "schedule_skew": -97,
          "Rroof": 21.61,
          "Rwall": 9.3,
          "Rfloor": 11.38,
          "Rdoors": 3,
          "Rwindows": 1.56,
          "airchange_per_hour": 1.02,
          "hvac_power_factor": 0.97,
          "cooling_system_type": "ELECTRIC",
          "heating_system_type": "RESISTANCE",
          "fan_type": "ONE_SPEED",
          "hvac_breaker_rating": 200,
          "total_thermal_mass_per_floor_area": 4.59,
          "motor_efficiency": "AVERAGE",
          "motor_model": "BASIC",
          "cooling_COP": 3.75,
          "floor_area": 1438,
          "number_of_doors": 2,
          "air_temperature": 71.9,
          "mass_temperature": 71.9,
          "inside_comments": [
            "//Residential_1"
          ]
        },
        {
          "name": "H_3",
          "parent": "_tpm_rt_B3",
          "schedule_skew": -481,
          "Rroof": 18.58,
          "Rwall": 11.08,
          "Rfloor": 11.36,
          "Rdoors": 3,
          "Rwindows": 0.91,
          "airchange_per_hour": 0.97,
          "hvac_power_factor": 0.97,
          "cooling_system_type": "ELECTRIC",
          "heating_system_type": "RESISTANCE",
          "fan_type": "ONE_SPEED",
          "hvac_breaker_rating": 200,
          "total_thermal_mass_per_floor_area": 3.64,
          "motor_efficiency": "AVERAGE",
          "motor_model": "BASIC",
          "cooling_COP": 3.22,
          "floor_area": 3176,
          "number_of_doors": 4,
          "air_temperature": 71.2,
          "mass_temperature": 71.2,
          "inside_comments": [
            "//Residential_3"
          ]
        },
        {
          "name": "H_4",
          "parent": "_tpm_rt_C4",
          "schedule_skew": 1997,
          "Rroof": 16.68,
          "Rwall": 11.39,
          "Rfloor": 11.98,
          "Rdoors": 3,
          "Rwindows": 1.08,
          "airchange_per_hour": 0.81,
          "hvac_power_factor": 0.97,
          "cooling_system_type": "ELECTRIC",
          "heating_system_type": "RESISTANCE",
          "fan_type": "ONE_SPEED",
          "hvac_breaker_rating": 200,
          "total_thermal_mass_per_floor_area": 4.35,
          "motor_efficiency": "AVERAGE",
          "motor_model": "BASIC",
          "cooling_COP": 3.18,
          "floor_area": 618,
          "number_of_doors": 1,
          "air_temperature": 71.7,
          "mass_temperature": 71.7,
          "inside_comments": [
            "//Residential_1"
          ]
        },
        {
          "name": "H_5",
          "parent": "_tpm_rt_C5",
          "schedule_skew": -2380,
          "Rroof": 17.77,
          "Rwall": 8.67,
          "Rfloor": 10.59,
          "Rdoors": 3,
          "Rwindows": 1.14,
          "airchange_per_hour": 1.16,
          "hvac_power_factor": 0.97,
          "cooling_system_type": "ELECTRIC",
          "heating_system_type": "RESISTANCE",
          "fan_type": "ONE_SPEED",
          "hvac_breaker_rating": 200,
          "total_thermal_mass_per_floor_area": 4.9,
          "motor_efficiency": "AVERAGE",
          "motor_model": "BASIC",
          "cooling_COP": 2.82,
          "floor_area": 746,
          "number_of_doors": 1,
          "air_temperature": 69.5,
          "mass_temperature": 69.5,
          "inside_comments": [
            "//Residential_1"
          ]
        }
      ]
    }
  }
}

docs/docs/3.0 Modeling/3.2 Modules/Powerflow/Power_Flow_User_Guide.md

## Triplex Line Configuration

object triplex_line_configuration {
    		conductor_1 trip_cond_H;
    		conductor_2 trip_cond_H;
    		conductor_N trip_cond_N;
    		insulation_thickness 0.08 in;
    		diameter 0.368 in;
    		}

## Triplex Conductor

object triplex_line_conductor {
    	name trip_cond_1;
    	resistance 0.97;
    	geometric_mean_radius 0.0111;		
    	}

## Transformer Configuration

object transformer_configuration {
    	name xfrm_config_400;
    	connect_type DELTA_DELTA;
    	install_type PADMOUNT;
    	power_rating 500;
    	primary_voltage 4800;
    	secondary_voltage 480;
    	resistance 0.09;
    	reactance 1.81;
    	}

## Volt-VAr Control

object volt_var_control {
    	name IVVC37;
    	control_method ACTIVE;
    	capacitor_delay 10.0;
    	regulator_delay 5.0;
    	desired_pf 0.98;
    	d_max 0.8;
    	d_min 0.1;
    	substation_link "SubTransNode-799";
    	regulator_list "reg799-781,regnode799-U0081";
    	capacitor_list "CapNode_A,CapNode_B";
    	voltage_measurements "load829,1,load841,1,load825,1,U0029,2,U0041,2,U0025,2";
    	minimum_voltages 2500.0;
    	maximum_voltages 3000.0;
    	desired_voltages 2600.0;
    }

## Power Metrics

object power_metrics {
    	name PwrMetrics;
    	base_time_value 60.0;
    	}